{
  "workspaceName": "Hive Collective",
  "purpose": "Empower women 40+ through yoga, fitness, and wellness content that is accessible, evidence-based, and confidence-building.",
  "mission": "Build the most trusted wellness content brand for women in midlife.",
  "timezone": "America/New_York",
  "language": "en-US",
  "brandColor": "#d94e33",
  "logoUrl": "https://cdn.hivecollective.io/logo-2026.svg",
  "website": "https://hivecollective.io",
  "contactEmail": "hello@hivecollective.io",
  "status": "active"
}
